{"id":"1","userName":"adham","password":"0003","email":"null@example.com","contacts":{"contacts":[],"sortedContacts":[]},"mailFolders":{"inboxFolder":[],"sentFolder":[{"subject":"","priority":1,"body":"","sender":"adham","recipients":["adham1"],"date":"","deletedDate":"","attachment":["adham1"],"folderNameBeforeDelete":""}],"draftFolder":[],"trashFolder":[],"sortedMail":[]}}